[
  {
    "player_id": "",
    "name": "Unknown",
    "team": "UNK",
    "status": "Unknown",
    "injury_type": "Unknown",
    "return_date": null
  },
  {
    "player_id": "",
    "name": "Unknown",
    "team": "UNK",
    "status": "Unknown",
    "injury_type": "Unknown",
    "return_date": null
  },
  {
    "player_id": "",
    "name": "Unknown",
    "team": "UNK",
    "status": "Unknown",
    "injury_type": "Unknown",
    "return_date": null
  },
  {
    "player_id": "",
    "name": "Unknown",
    "team": "UNK",
    "status": "Unknown",
    "injury_type": "Unknown",
    "return_date": null
  },
  {
    "player_id": "",
    "name": "Unknown",
    "team": "UNK",
    "status": "Unknown",
    "injury_type": "Unknown",
    "return_date": null
  },
  {
    "player_id": "",
    "name": "Unknown",
    "team": "UNK",
    "status": "Unknown",
    "injury_type": "Unknown",
    "return_date": null
  },
  {
    "player_id": "",
    "name": "Unknown",
    "team": "UNK",
    "status": "Unknown",
    "injury_type": "Unknown",
    "return_date": null
  },
  {
    "player_id": "",
    "name": "Unknown",
    "team": "UNK",
    "status": "Unknown",
    "injury_type": "Unknown",
    "return_date": null
  },
  {
    "player_id": "",
    "name": "Unknown",
    "team": "UNK",
    "status": "Unknown",
    "injury_type": "Unknown",
    "return_date": null
  },
  {
    "player_id": "",
    "name": "Unknown",
    "team": "UNK",
    "status": "Unknown",
    "injury_type": "Unknown",
    "return_date": null
  },
  {
    "player_id": "",
    "name": "Unknown",
    "team": "UNK",
    "status": "Unknown",
    "injury_type": "Unknown",
    "return_date": null
  },
  {
    "player_id": "",
    "name": "Unknown",
    "team": "UNK",
    "status": "Unknown",
    "injury_type": "Unknown",
    "return_date": null
  },
  {
    "player_id": "",
    "name": "Unknown",
    "team": "UNK",
    "status": "Unknown",
    "injury_type": "Unknown",
    "return_date": null
  },
  {
    "player_id": "",
    "name": "Unknown",
    "team": "UNK",
    "status": "Unknown",
    "injury_type": "Unknown",
    "return_date": null
  },
  {
    "player_id": "",
    "name": "Unknown",
    "team": "UNK",
    "status": "Unknown",
    "injury_type": "Unknown",
    "return_date": null
  },
  {
    "player_id": "",
    "name": "Unknown",
    "team": "UNK",
    "status": "Unknown",
    "injury_type": "Unknown",
    "return_date": null
  },
  {
    "player_id": "",
    "name": "Unknown",
    "team": "UNK",
    "status": "Unknown",
    "injury_type": "Unknown",
    "return_date": null
  },
  {
    "player_id": "",
    "name": "Unknown",
    "team": "UNK",
    "status": "Unknown",
    "injury_type": "Unknown",
    "return_date": null
  },
  {
    "player_id": "",
    "name": "Unknown",
    "team": "UNK",
    "status": "Unknown",
    "injury_type": "Unknown",
    "return_date": null
  },
  {
    "player_id": "",
    "name": "Unknown",
    "team": "UNK",
    "status": "Unknown",
    "injury_type": "Unknown",
    "return_date": null
  },
  {
    "player_id": "",
    "name": "Unknown",
    "team": "UNK",
    "status": "Unknown",
    "injury_type": "Unknown",
    "return_date": null
  },
  {
    "player_id": "",
    "name": "Unknown",
    "team": "UNK",
    "status": "Unknown",
    "injury_type": "Unknown",
    "return_date": null
  },
  {
    "player_id": "",
    "name": "Unknown",
    "team": "UNK",
    "status": "Unknown",
    "injury_type": "Unknown",
    "return_date": null
  },
  {
    "player_id": "",
    "name": "Unknown",
    "team": "UNK",
    "status": "Unknown",
    "injury_type": "Unknown",
    "return_date": null
  },
  {
    "player_id": "",
    "name": "Unknown",
    "team": "UNK",
    "status": "Unknown",
    "injury_type": "Unknown",
    "return_date": null
  },
  {
    "player_id": "",
    "name": "Unknown",
    "team": "UNK",
    "status": "Unknown",
    "injury_type": "Unknown",
    "return_date": null
  },
  {
    "player_id": "",
    "name": "Unknown",
    "team": "UNK",
    "status": "Unknown",
    "injury_type": "Unknown",
    "return_date": null
  },
  {
    "player_id": "",
    "name": "Unknown",
    "team": "UNK",
    "status": "Unknown",
    "injury_type": "Unknown",
    "return_date": null
  },
  {
    "player_id": "",
    "name": "Unknown",
    "team": "UNK",
    "status": "Unknown",
    "injury_type": "Unknown",
    "return_date": null
  },
  {
    "player_id": "",
    "name": "Unknown",
    "team": "UNK",
    "status": "Unknown",
    "injury_type": "Unknown",
    "return_date": null
  }
]